{
  "schema_version": "nma.domain-contract-conformance/1.0",
  "record_id": "GEN-02-BUILD",
  "record_sha256": "d780bd83706749b37dbfcb0ae5d9d06ac1626827bc20cbc0c6226bf314ddd97a",
  "domain_id": "build",
  "evaluated_gen01_contract": {
    "commit": "7bb83f05480f642da23e7a2b244b38c3804d5fb7",
    "closure_sha256": "03b80441bbf317ac2e2b6cd92c3a86309c4cc7465109a3d34b6d24636491c35d",
    "closure_path": "data/specifications/nma-gen-01-generic-contract-interface-closure-v1.0.json",
    "lifecycle_contract": "nma.generic-lifecycle-envelope/1.0",
    "adapter_capability_contract": "nma.generic-domain-adapter-capability/1.0"
  },
  "adapter_contract": {
    "id": "nma.generic-domain-adapter",
    "version": "1.0",
    "classification": "CONFORMS"
  },
  "frozen_implementation": {
    "reference": "nma-build-v1.0-final",
    "commit": "95de5fa3657a2c8ac7847f1ee1010c48ea984cd7",
    "modified": false,
    "refactor_required": false
  },
  "contract_concerns": {
    "identity": {
      "classification": "CONFORMS",
      "evidence_paths": [
        "src/nma/core/identity.py",
        "build_contracts/building_production_implementation.py"
      ]
    },
    "lifecycle_envelope": {
      "classification": "CONFORMS",
      "evidence_paths": [
        "schemas/building-controlled-production-implementation-v1.0.schema.json",
        "schemas/building-production-activation-readiness-v1.0.schema.json"
      ]
    },
    "adapter_boundary": {
      "classification": "CONFORMS",
      "evidence_paths": [
        "build_contracts/building_production_implementation.py",
        "build_contracts/building_production_verification.py"
      ]
    },
    "domain_ownership": {
      "classification": "CONFORMS",
      "evidence_paths": [
        "build_contracts/resolution.py",
        "build_contracts/building_production_implementation.py"
      ]
    },
    "versioning": {
      "classification": "CONFORMS",
      "evidence_paths": [
        "schemas/building-finalized-production-contract-v1.0.schema.json",
        "schemas/building-controlled-production-implementation-v1.0.schema.json"
      ]
    },
    "mutation_boundary": {
      "classification": "CONFORMS",
      "evidence_paths": [
        "build_contracts/building_production_implementation.py",
        "build_contracts/building_production_verification.py"
      ]
    }
  },
  "mandatory_capabilities": {
    "domain_identification": {
      "classification": "CONFORMS",
      "evidence_paths": [
        "build_contracts/resolution.py"
      ]
    },
    "contract_version_declaration": {
      "classification": "CONFORMS",
      "evidence_paths": [
        "schemas/building-finalized-production-contract-v1.0.schema.json"
      ]
    },
    "input_validation": {
      "classification": "CONFORMS",
      "evidence_paths": [
        "build_contracts/building_production_implementation.py"
      ]
    },
    "canonical_identity_consumption": {
      "classification": "CONFORMS",
      "evidence_paths": [
        "src/nma/core/identity.py",
        "build_contracts/building_production_implementation.py"
      ]
    },
    "authorization_consumption": {
      "classification": "CONFORMS",
      "evidence_paths": [
        "build_contracts/human_building_production_policy.py",
        "build_contracts/building_production_implementation.py"
      ]
    },
    "planning_boundary": {
      "classification": "CONFORMS",
      "evidence_paths": [
        "schemas/building-controlled-production-implementation-v1.0.schema.json"
      ]
    },
    "execution_boundary": {
      "classification": "CONFORMS",
      "evidence_paths": [
        "build_contracts/building_production_implementation.py"
      ]
    },
    "observation_production": {
      "classification": "CONFORMS",
      "evidence_paths": [
        "schemas/building-controlled-production-implementation-v1.0.schema.json"
      ]
    },
    "receipt_production": {
      "classification": "CONFORMS",
      "evidence_paths": [
        "build_contracts/building_production_implementation.py"
      ]
    },
    "provenance_reporting": {
      "classification": "CONFORMS",
      "evidence_paths": [
        "build_contracts/building_production_implementation.py",
        "build_contracts/building_production_verification.py"
      ]
    },
    "verification_boundary": {
      "classification": "CONFORMS",
      "evidence_paths": [
        "build_contracts/building_production_verification.py",
        "schemas/building-production-activation-readiness-v1.0.schema.json"
      ]
    },
    "capability_declaration": {
      "classification": "CONFORMS",
      "evidence_paths": [
        "schemas/generic-domain-adapter-capability-v1.0.schema.json"
      ]
    }
  },
  "optional_capabilities": {
    "rollback_evidence": {
      "declared": true,
      "classification": "CONFORMS_AS_OPTIONAL_CAPABILITY",
      "behavior_owner": "domain",
      "contract_reference": {
        "contract_id": "nma.build-cleanup-and-deactivation",
        "contract_version": "1.0",
        "evidence_paths": [
          "build_contracts/building_production_activation.py",
          "build_contracts/building_production_implementation.py"
        ]
      }
    },
    "activation_evidence": {
      "declared": true,
      "classification": "CONFORMS_AS_OPTIONAL_CAPABILITY",
      "behavior_owner": "domain",
      "contract_reference": {
        "contract_id": "nma.building-production-activation",
        "contract_version": "1.0",
        "evidence_paths": [
          "schemas/building-production-activation-v1.0.schema.json",
          "build_contracts/building_production_activation.py"
        ]
      }
    },
    "release_evidence": {
      "declared": true,
      "classification": "CONFORMS_AS_OPTIONAL_CAPABILITY",
      "behavior_owner": "domain",
      "contract_reference": {
        "contract_id": "nma.build-release",
        "contract_version": "1.0",
        "evidence_paths": [
          "BUILD-FINAL-Completion-Report.md",
          "data/specifications/nma-build-final-freeze-manifest-v1.0.json"
        ]
      }
    }
  },
  "generic_invariants": {
    "GINV-01": {
      "classification": "CONFORMS",
      "evidence_paths": [
        "build_contracts/building_production_implementation.py"
      ]
    },
    "GINV-02": {
      "classification": "CONFORMS",
      "evidence_paths": [
        "src/nma/core/identity.py",
        "build_contracts/building_production_implementation.py"
      ]
    },
    "GINV-03": {
      "classification": "CONFORMS",
      "evidence_paths": [
        "build_contracts/building_production_implementation.py"
      ]
    },
    "GINV-04": {
      "classification": "CONFORMS",
      "evidence_paths": [
        "schemas/building-controlled-production-implementation-v1.0.schema.json"
      ]
    },
    "GINV-05": {
      "classification": "CONFORMS",
      "evidence_paths": [
        "build_contracts/building_production_implementation.py"
      ]
    },
    "GINV-06": {
      "classification": "CONFORMS",
      "evidence_paths": [
        "build_contracts/building_production_verification.py"
      ]
    },
    "GINV-07": {
      "classification": "CONFORMS",
      "evidence_paths": [
        "schemas/generic-lifecycle-envelope-v1.0.schema.json"
      ]
    },
    "GINV-08": {
      "classification": "CONFORMS",
      "evidence_paths": [
        "schemas/building-finalized-production-contract-v1.0.schema.json"
      ]
    },
    "GINV-09": {
      "classification": "CONFORMS",
      "evidence_paths": [
        "schemas/building-production-activation-v1.0.schema.json",
        "data/specifications/nma-build-final-freeze-manifest-v1.0.json"
      ]
    },
    "GINV-10": {
      "classification": "CONFORMS",
      "evidence_paths": [
        "BUILD-FINAL-Completion-Report.md",
        "GEN-01-Completion-Report.md"
      ]
    }
  },
  "domain_owned_responsibilities": {
    "semantics": "DOMAIN_OWNED_NOT_APPLICABLE",
    "geometry": "DOMAIN_OWNED_NOT_APPLICABLE",
    "portrayal": "DOMAIN_OWNED_NOT_APPLICABLE",
    "rollback_behavior": "DOMAIN_OWNED_NOT_APPLICABLE",
    "activation_behavior": "DOMAIN_OWNED_NOT_APPLICABLE"
  },
  "mutation_boundary": {
    "source_mutation": false,
    "writeback": false,
    "automatic_repair": false,
    "geometry_mutation": false,
    "portrayal_mutation": false,
    "production_activation": false,
    "authorization_bypass": false,
    "classification": "CONFORMS"
  },
  "evidence_paths": [
    "build_contracts/resolution.py",
    "build_contracts/human_building_production_policy.py",
    "build_contracts/building_production_implementation.py",
    "build_contracts/building_production_verification.py",
    "build_contracts/building_production_activation.py",
    "schemas/building-finalized-production-contract-v1.0.schema.json",
    "schemas/building-controlled-production-implementation-v1.0.schema.json",
    "schemas/building-production-activation-readiness-v1.0.schema.json",
    "schemas/building-production-activation-v1.0.schema.json",
    "data/specifications/nma-build-final-freeze-manifest-v1.0.json"
  ],
  "overall_conformance_verdict": "CONFORMS"
}
