{
  "schema_version": "nma.domain-contract-conformance/1.0",
  "record_id": "GEN-02-ROAD",
  "record_sha256": "6b9f3c1511cb6ff9dfc3f1f731a4d315360a83f2fb8490302fe805efd7bd9288",
  "domain_id": "road",
  "evaluated_gen01_contract": {
    "commit": "7bb83f05480f642da23e7a2b244b38c3804d5fb7",
    "closure_sha256": "03b80441bbf317ac2e2b6cd92c3a86309c4cc7465109a3d34b6d24636491c35d",
    "closure_path": "data/specifications/nma-gen-01-generic-contract-interface-closure-v1.0.json",
    "lifecycle_contract": "nma.generic-lifecycle-envelope/1.0",
    "adapter_capability_contract": "nma.generic-domain-adapter-capability/1.0"
  },
  "adapter_contract": {
    "id": "nma.generic-domain-adapter",
    "version": "1.0",
    "classification": "CONFORMS"
  },
  "frozen_implementation": {
    "reference": "nma-road-v1.0-final",
    "commit": "325c70d5335f57c43a8af85822db25032aa225c3",
    "modified": false,
    "refactor_required": false
  },
  "contract_concerns": {
    "identity": {
      "classification": "CONFORMS",
      "evidence_paths": [
        "src/nma/core/identity.py",
        "src/nma/road_resolution.py"
      ]
    },
    "lifecycle_envelope": {
      "classification": "CONFORMS",
      "evidence_paths": [
        "schemas/road-execution-plan-v1.0.schema.json",
        "schemas/road-execution-receipt-v1.0.schema.json",
        "schemas/road-provenance-v1.0.schema.json"
      ]
    },
    "adapter_boundary": {
      "classification": "CONFORMS",
      "evidence_paths": [
        "src/nma/road_execution.py",
        "src/nma/road_verification.py"
      ]
    },
    "domain_ownership": {
      "classification": "CONFORMS",
      "evidence_paths": [
        "src/nma/road_resolution.py",
        "src/nma/road_execution.py"
      ]
    },
    "versioning": {
      "classification": "CONFORMS",
      "evidence_paths": [
        "schemas/road-execution-plan-v1.0.schema.json",
        "schemas/road-qa-v1.0.schema.json"
      ]
    },
    "mutation_boundary": {
      "classification": "CONFORMS",
      "evidence_paths": [
        "src/nma/road_execution.py",
        "src/nma/road_verification.py"
      ]
    }
  },
  "mandatory_capabilities": {
    "domain_identification": {
      "classification": "CONFORMS",
      "evidence_paths": [
        "src/nma/road_resolution.py"
      ]
    },
    "contract_version_declaration": {
      "classification": "CONFORMS",
      "evidence_paths": [
        "schemas/road-execution-plan-v1.0.schema.json"
      ]
    },
    "input_validation": {
      "classification": "CONFORMS",
      "evidence_paths": [
        "src/nma/road_execution.py"
      ]
    },
    "canonical_identity_consumption": {
      "classification": "CONFORMS",
      "evidence_paths": [
        "src/nma/core/identity.py",
        "src/nma/road_resolution.py"
      ]
    },
    "authorization_consumption": {
      "classification": "CONFORMS",
      "evidence_paths": [
        "src/nma/road_approval.py",
        "src/nma/road_execution.py"
      ]
    },
    "planning_boundary": {
      "classification": "CONFORMS",
      "evidence_paths": [
        "schemas/road-execution-plan-v1.0.schema.json"
      ]
    },
    "execution_boundary": {
      "classification": "CONFORMS",
      "evidence_paths": [
        "src/nma/road_execution.py"
      ]
    },
    "observation_production": {
      "classification": "CONFORMS",
      "evidence_paths": [
        "schemas/road-runtime-observation-v1.0.schema.json"
      ]
    },
    "receipt_production": {
      "classification": "CONFORMS",
      "evidence_paths": [
        "schemas/road-execution-receipt-v1.0.schema.json"
      ]
    },
    "provenance_reporting": {
      "classification": "CONFORMS",
      "evidence_paths": [
        "schemas/road-provenance-v1.0.schema.json"
      ]
    },
    "verification_boundary": {
      "classification": "CONFORMS",
      "evidence_paths": [
        "src/nma/road_verification.py",
        "schemas/road-qa-v1.0.schema.json"
      ]
    },
    "capability_declaration": {
      "classification": "CONFORMS",
      "evidence_paths": [
        "schemas/generic-domain-adapter-capability-v1.0.schema.json"
      ]
    }
  },
  "optional_capabilities": {
    "rollback_evidence": {
      "declared": true,
      "classification": "CONFORMS_AS_OPTIONAL_CAPABILITY",
      "behavior_owner": "domain",
      "contract_reference": {
        "contract_id": "nma.road-rollback",
        "contract_version": "1.0",
        "evidence_paths": [
          "schemas/road-rollback-manifest-v1.0.schema.json",
          "src/nma/road_execution.py"
        ]
      }
    },
    "activation_evidence": {
      "declared": false,
      "classification": "NOT_SUPPORTED_BY_DOMAIN",
      "behavior_owner": "domain",
      "contract_reference": null
    },
    "release_evidence": {
      "declared": true,
      "classification": "CONFORMS_AS_OPTIONAL_CAPABILITY",
      "behavior_owner": "domain",
      "contract_reference": {
        "contract_id": "nma.road-release",
        "contract_version": "1.0",
        "evidence_paths": [
          "ROAD-FINAL-Completion-Report.md",
          "data/specifications/nma-road-final-freeze-manifest-v1.0.json"
        ]
      }
    }
  },
  "generic_invariants": {
    "GINV-01": {
      "classification": "CONFORMS",
      "evidence_paths": [
        "src/nma/road_resolution.py"
      ]
    },
    "GINV-02": {
      "classification": "CONFORMS",
      "evidence_paths": [
        "src/nma/core/identity.py",
        "src/nma/road_resolution.py"
      ]
    },
    "GINV-03": {
      "classification": "CONFORMS",
      "evidence_paths": [
        "src/nma/road_execution.py"
      ]
    },
    "GINV-04": {
      "classification": "CONFORMS",
      "evidence_paths": [
        "schemas/road-execution-plan-v1.0.schema.json"
      ]
    },
    "GINV-05": {
      "classification": "CONFORMS",
      "evidence_paths": [
        "src/nma/road_execution.py"
      ]
    },
    "GINV-06": {
      "classification": "CONFORMS",
      "evidence_paths": [
        "schemas/road-provenance-v1.0.schema.json"
      ]
    },
    "GINV-07": {
      "classification": "CONFORMS",
      "evidence_paths": [
        "schemas/generic-lifecycle-envelope-v1.0.schema.json"
      ]
    },
    "GINV-08": {
      "classification": "CONFORMS",
      "evidence_paths": [
        "schemas/road-execution-receipt-v1.0.schema.json"
      ]
    },
    "GINV-09": {
      "classification": "CONFORMS",
      "evidence_paths": [
        "schemas/road-rollback-manifest-v1.0.schema.json",
        "data/specifications/nma-road-final-freeze-manifest-v1.0.json"
      ]
    },
    "GINV-10": {
      "classification": "CONFORMS",
      "evidence_paths": [
        "ROAD-FINAL-Completion-Report.md",
        "GEN-01-Completion-Report.md"
      ]
    }
  },
  "domain_owned_responsibilities": {
    "semantics": "DOMAIN_OWNED_NOT_APPLICABLE",
    "geometry": "DOMAIN_OWNED_NOT_APPLICABLE",
    "portrayal": "DOMAIN_OWNED_NOT_APPLICABLE",
    "rollback_behavior": "DOMAIN_OWNED_NOT_APPLICABLE",
    "activation_behavior": "DOMAIN_OWNED_NOT_APPLICABLE"
  },
  "mutation_boundary": {
    "source_mutation": false,
    "writeback": false,
    "automatic_repair": false,
    "geometry_mutation": false,
    "portrayal_mutation": false,
    "production_activation": false,
    "authorization_bypass": false,
    "classification": "CONFORMS"
  },
  "evidence_paths": [
    "src/nma/road_resolution.py",
    "src/nma/road_approval.py",
    "src/nma/road_execution.py",
    "src/nma/road_verification.py",
    "schemas/road-execution-plan-v1.0.schema.json",
    "schemas/road-execution-receipt-v1.0.schema.json",
    "schemas/road-provenance-v1.0.schema.json",
    "schemas/road-qa-v1.0.schema.json",
    "schemas/road-rollback-manifest-v1.0.schema.json",
    "data/specifications/nma-road-final-freeze-manifest-v1.0.json"
  ],
  "overall_conformance_verdict": "CONFORMS"
}
